{
  "schemaVersion": 3,
  "maxProcessesPerApplication": 8,
  "maxUnmatchedProcesses": 12,
  "strategies": [
    {
      "id": "exact-main-executable",
      "kind": "exactMainExecutable",
      "confidence": "confirmed",
      "priority": 100
    },
    {
      "id": "contained-in-application-bundle",
      "kind": "containedInApplicationBundle",
      "confidence": "high",
      "priority": 80
    },
    {
      "id": "relocated-bundle-name",
      "kind": "relocatedBundleName",
      "confidence": "probable",
      "priority": 40
    }
  ]
}
